{"schema":"oreflow.geomet-lct/v1","source":{"title":"GeoMet dataset","record":"https://zenodo.org/records/7051975","doi":"10.5281/zenodo.7051975","concept_doi":"10.5281/zenodo.6336137","paper_doi":"10.1007/s11004-022-10013-1","license":"CC BY 4.0","md5":"f2e90da6bfa81de1261177ee85a91570","sha256":"e7968c250c1ccc17b63da6d9624473dd92b32a7ba8d8772e70070a0115e42eda","raw_rows":53,"usable_rows":52,"holes":29,"exclusions":[{"source_row":29,"reason":"missing LCT"}]},"protocol":{"target":"LCT measured locked-cycle copper recovery, converted from fraction to percent","features":["Cu ppm","Fe ppm","S ppm","Si ppm","Al ppm"],"transform":"log1p of nonnegative ppm; fold-local median imputation; fold-local scaling for ridge/GP","excluded_features":["HOLEID","X","Y","Z","fr","xr","LCT"],"hole":"five GroupKFold folds; complete holes excluded from training","zone":"three GroupKFold folds; holes sorted by mean X into three spatial zones","models":{"train_mean":"training-fold mean","ridge":"alpha=10","random_forest":"160 trees, leaf>=3, max_features=0.8, seed=42","gaussian_process":"fixed RBF length-scale=2 and white noise=0.05; train-conditioned"},"boundary":"one deposit, sparse locked-cycle tests; no grind/reagent/residence controls; not a plant operating-point model"},"protocols":{"hole":{"folds":[{"id":0,"train_rows":41,"test_rows":11,"train_holes":23,"test_holes":6,"test_source_rows":[4,9,16,38,39,40,42,43,49,50,53]},{"id":1,"train_rows":41,"test_rows":11,"train_holes":23,"test_holes":6,"test_source_rows":[3,5,6,7,8,15,24,32,41,48,52]},{"id":2,"train_rows":42,"test_rows":10,"train_holes":24,"test_holes":5,"test_source_rows":[2,12,13,14,21,22,23,28,47,51]},{"id":3,"train_rows":42,"test_rows":10,"train_holes":23,"test_holes":6,"test_source_rows":[11,19,20,25,26,33,34,35,45,54]},{"id":4,"train_rows":42,"test_rows":10,"train_holes":23,"test_holes":6,"test_source_rows":[10,17,18,27,30,31,36,37,44,46]}],"scores":{"train_mean":{"mae_pp":4.3977,"rmse_pp":5.5075,"bias_pp":-0.0269,"r2":-0.0917},"ridge":{"mae_pp":4.086,"rmse_pp":5.09,"bias_pp":-0.123,"r2":0.0676},"random_forest":{"mae_pp":4.4833,"rmse_pp":5.4149,"bias_pp":-0.5331,"r2":-0.0552},"gaussian_process":{"mae_pp":4.0244,"rmse_pp":5.2011,"bias_pp":-0.5604,"r2":0.0265}},"rows":[{"source_row":2,"hole_id":"1.0","x":552.477,"y":-532.304,"observed_lct_pct":87.8482,"fold":2,"predictions_pct":{"train_mean":88.0901,"ridge":86.1138,"random_forest":85.2006,"gaussian_process":84.7194}},{"source_row":3,"hole_id":"2.0","x":745.775,"y":-279.773,"observed_lct_pct":94.2708,"fold":1,"predictions_pct":{"train_mean":86.912,"ridge":90.6223,"random_forest":90.2272,"gaussian_process":91.9389}},{"source_row":4,"hole_id":"5.0","x":200.35,"y":-520.864,"observed_lct_pct":87.566,"fold":0,"predictions_pct":{"train_mean":87.7326,"ridge":88.2473,"random_forest":88.3788,"gaussian_process":91.0827}},{"source_row":5,"hole_id":"6.0","x":494.372,"y":-528.868,"observed_lct_pct":91.288,"fold":1,"predictions_pct":{"train_mean":86.912,"ridge":85.6868,"random_forest":87.7402,"gaussian_process":86.4635}},{"source_row":6,"hole_id":"6.0","x":500.225,"y":-513.621,"observed_lct_pct":93.7375,"fold":1,"predictions_pct":{"train_mean":86.912,"ridge":87.8813,"random_forest":84.7853,"gaussian_process":84.6278}},{"source_row":7,"hole_id":"6.0","x":506.353,"y":-497.656,"observed_lct_pct":95.811,"fold":1,"predictions_pct":{"train_mean":86.912,"ridge":87.7755,"random_forest":85.5498,"gaussian_process":86.7816}},{"source_row":8,"hole_id":"6.0","x":509.54,"y":-489.354,"observed_lct_pct":92.053,"fold":1,"predictions_pct":{"train_mean":86.912,"ridge":87.4277,"random_forest":85.6553,"gaussian_process":86.7812}},{"source_row":9,"hole_id":"132.0","x":461.213,"y":-329.226,"observed_lct_pct":89.8224,"fold":0,"predictions_pct":{"train_mean":87.7326,"ridge":88.2008,"random_forest":88.4272,"gaussian_process":89.7639}},{"source_row":10,"hole_id":"11.0","x":555.409,"y":-276.887,"observed_lct_pct":90.2874,"fold":4,"predictions_pct":{"train_mean":88.3312,"ridge":87.6924,"random_forest":87.2221,"gaussian_process":89.0213}},{"source_row":11,"hole_id":"13.0","x":359.17,"y":-462.016,"observed_lct_pct":94.451,"fold":3,"predictions_pct":{"train_mean":88.3411,"ridge":91.3204,"random_forest":90.7517,"gaussian_process":92.1953}},{"source_row":12,"hole_id":"14.0","x":512.801,"y":-344.453,"observed_lct_pct":86.5263,"fold":2,"predictions_pct":{"train_mean":88.0901,"ridge":88.5681,"random_forest":86.9725,"gaussian_process":86.3499}},{"source_row":13,"hole_id":"48.0","x":418.583,"y":-313.395,"observed_lct_pct":85.261,"fold":2,"predictions_pct":{"train_mean":88.0901,"ridge":86.5851,"random_forest":91.9164,"gaussian_process":88.6813}},{"source_row":14,"hole_id":"1.0","x":549.264,"y":-540.676,"observed_lct_pct":92.0573,"fold":2,"predictions_pct":{"train_mean":88.0901,"ridge":87.1958,"random_forest":91.9539,"gaussian_process":88.1716}},{"source_row":15,"hole_id":"2.0","x":737.62,"y":-301.018,"observed_lct_pct":91.7786,"fold":1,"predictions_pct":{"train_mean":86.912,"ridge":92.0162,"random_forest":90.2272,"gaussian_process":91.9362}},{"source_row":16,"hole_id":"5.0","x":211.149,"y":-492.731,"observed_lct_pct":84.2956,"fold":0,"predictions_pct":{"train_mean":87.7326,"ridge":88.7274,"random_forest":88.9824,"gaussian_process":89.2608}},{"source_row":17,"hole_id":"11.0","x":560.71,"y":-263.078,"observed_lct_pct":91.467,"fold":4,"predictions_pct":{"train_mean":88.3312,"ridge":87.0111,"random_forest":87.963,"gaussian_process":85.8594}},{"source_row":18,"hole_id":"11.0","x":547.656,"y":-297.083,"observed_lct_pct":89.9184,"fold":4,"predictions_pct":{"train_mean":88.3312,"ridge":88.4145,"random_forest":85.848,"gaussian_process":85.8836}},{"source_row":19,"hole_id":"13.0","x":362.05,"y":-454.513,"observed_lct_pct":86.7795,"fold":3,"predictions_pct":{"train_mean":88.3411,"ridge":88.0997,"random_forest":84.2415,"gaussian_process":85.7071}},{"source_row":20,"hole_id":"13.0","x":364.685,"y":-447.648,"observed_lct_pct":82.14,"fold":3,"predictions_pct":{"train_mean":88.3411,"ridge":88.043,"random_forest":87.297,"gaussian_process":84.047}},{"source_row":21,"hole_id":"14.0","x":517.067,"y":-333.341,"observed_lct_pct":89.1741,"fold":2,"predictions_pct":{"train_mean":88.0901,"ridge":86.3609,"random_forest":86.0492,"gaussian_process":87.2379}},{"source_row":22,"hole_id":"14.0","x":507.202,"y":-359.039,"observed_lct_pct":90.5342,"fold":2,"predictions_pct":{"train_mean":88.0901,"ridge":86.1775,"random_forest":85.2504,"gaussian_process":83.4385}},{"source_row":23,"hole_id":"14.0","x":505.303,"y":-363.988,"observed_lct_pct":88.3535,"fold":2,"predictions_pct":{"train_mean":88.0901,"ridge":87.5898,"random_forest":84.7743,"gaussian_process":87.8325}},{"source_row":24,"hole_id":"19.0","x":948.134,"y":-509.025,"observed_lct_pct":88.19,"fold":1,"predictions_pct":{"train_mean":86.912,"ridge":92.5974,"random_forest":90.5539,"gaussian_process":88.508}},{"source_row":25,"hole_id":"29.0","x":897.076,"y":-597.916,"observed_lct_pct":81.5144,"fold":3,"predictions_pct":{"train_mean":88.3411,"ridge":87.0373,"random_forest":87.4325,"gaussian_process":88.217}},{"source_row":26,"hole_id":"29.0","x":878.101,"y":-647.348,"observed_lct_pct":90.4226,"fold":3,"predictions_pct":{"train_mean":88.3411,"ridge":87.3065,"random_forest":85.1026,"gaussian_process":85.1484}},{"source_row":27,"hole_id":"133.0","x":495.393,"y":-252.781,"observed_lct_pct":80.2454,"fold":4,"predictions_pct":{"train_mean":88.3312,"ridge":87.5484,"random_forest":87.003,"gaussian_process":83.9089}},{"source_row":28,"hole_id":"48.0","x":416.496,"y":-319.82,"observed_lct_pct":89.584,"fold":2,"predictions_pct":{"train_mean":88.0901,"ridge":87.1586,"random_forest":85.85,"gaussian_process":83.5609}},{"source_row":30,"hole_id":"3.0","x":-306.227,"y":311.909,"observed_lct_pct":81.6513,"fold":4,"predictions_pct":{"train_mean":88.3312,"ridge":86.6566,"random_forest":84.4737,"gaussian_process":86.0955}},{"source_row":31,"hole_id":"3.0","x":-310.274,"y":301.101,"observed_lct_pct":91.4803,"fold":4,"predictions_pct":{"train_mean":88.3312,"ridge":89.0143,"random_forest":87.7348,"gaussian_process":91.3123}},{"source_row":32,"hole_id":"7.0","x":-371.596,"y":386.885,"observed_lct_pct":90.5687,"fold":1,"predictions_pct":{"train_mean":86.912,"ridge":86.4735,"random_forest":90.086,"gaussian_process":86.8855}},{"source_row":33,"hole_id":"15.0","x":-822.119,"y":630.959,"observed_lct_pct":85.0658,"fold":3,"predictions_pct":{"train_mean":88.3411,"ridge":89.4311,"random_forest":87.6587,"gaussian_process":89.2774}},{"source_row":34,"hole_id":"18.0","x":-546.54,"y":240.872,"observed_lct_pct":82.4227,"fold":3,"predictions_pct":{"train_mean":88.3411,"ridge":90.4563,"random_forest":91.3462,"gaussian_process":95.9178}},{"source_row":35,"hole_id":"18.0","x":-530.037,"y":283.865,"observed_lct_pct":85.9164,"fold":3,"predictions_pct":{"train_mean":88.3411,"ridge":86.4889,"random_forest":83.3605,"gaussian_process":83.2927}},{"source_row":36,"hole_id":"28.0","x":-526.599,"y":294.025,"observed_lct_pct":74.3796,"fold":4,"predictions_pct":{"train_mean":88.3312,"ridge":87.4485,"random_forest":86.6943,"gaussian_process":85.2811}},{"source_row":37,"hole_id":"28.0","x":-524.286,"y":301.153,"observed_lct_pct":71.7578,"fold":4,"predictions_pct":{"train_mean":88.3312,"ridge":87.4955,"random_forest":87.915,"gaussian_process":87.2344}},{"source_row":38,"hole_id":"64.0","x":-676.117,"y":458.003,"observed_lct_pct":87.7004,"fold":0,"predictions_pct":{"train_mean":87.7326,"ridge":87.4581,"random_forest":84.7767,"gaussian_process":85.9729}},{"source_row":39,"hole_id":"64.0","x":-685.375,"y":438.072,"observed_lct_pct":87.2624,"fold":0,"predictions_pct":{"train_mean":87.7326,"ridge":87.2819,"random_forest":84.4803,"gaussian_process":85.9154}},{"source_row":40,"hole_id":"64.0","x":-691.363,"y":425.904,"observed_lct_pct":84.4209,"fold":0,"predictions_pct":{"train_mean":87.7326,"ridge":87.1845,"random_forest":84.345,"gaussian_process":85.3539}},{"source_row":41,"hole_id":"7.0","x":-361.105,"y":410.73,"